tck_iem_cd,외화증권한글명,fc_sec_eng_nm,주식/ETF코드,ltg_tot_stk_qty,fc_mkt_dit_cd,co_adr,web_adr,btp_cfc_nm,ceo_nm,eng_utk_otl_cts,ser_cfc_nm,ids_nm,mkt_pr_tot_amt
VWO,Vanguard Emerging Stock Index ETF                           ,VANGUARD FTSE EMERGING MARKETS ETF                          ,ETF,1750632944,-,-,-,-,-,-,-,-,0.0
VYM,Vanguard High Dividend Yield ETF                            ,VANGUARD HIGH DIVIDEND YIELD ETF                            ,ETF,456722323,-,-,-,-,-,-,-,-,0.0
WEBL,Direxion Dow Internet Bull 3X Shrs ETF                      ,DIREXION DAIY DW JNS INT BUL 3X ETF                         ,ETF,8100001,-,-,-,-,-,-,-,-,0.0
XBI,SPDR S&P Biotech ETF                                        ,SPDR S&P BIOTECH ETF                                        ,ETF,78850000,-,-,-,-,-,-,-,-,0.0
XLE,Energy Select Sector SPDR ETF                               ,ENERGY SELECT SECTOR SPDR ETF                               ,ETF,411024200,-,-,-,-,-,-,-,-,0.0
XLF,Financial Select Sector SPDR ETF                            ,SELECT STR FINANCIAL SELECT SPDR ETF                        ,ETF,987545427,-,-,-,-,-,-,-,-,0.0
XLK,Technology Select Sector SPDR ETF                           ,TECHNOLOGY SELECT SECTOR SPDR ETF                           ,ETF,316255897,-,-,-,-,-,-,-,-,0.0
XLP,Consumer Staples Select Sector SPDR ETF                     ,SPDR FUND CONSUMER STAPLES ETF                              ,ETF,207821809,-,-,-,-,-,-,-,-,0.0
XLRE,Real Estate Select Sector SPDR ETF                          ,REAL ESTATE SELECT SCTR SPDR ETF                            ,ETF,173800000,-,-,-,-,-,-,-,-,0.0
XLU,Utilities Select Sector SPDR ETF                            ,SELECT SECTOR UTI SELECT SPDR ETF                           ,ETF,228024160,-,-,-,-,-,-,-,-,0.0
XLV,SELECT SECTOR HEALTH CARE SPDR ETF                          ,SELECT SECTOR HEALTH CARE SPDR ETF                          ,ETF,269915324,-,-,-,-,-,-,-,-,0.0
XOMO,YIELDMAX XOM OPTION INC STRG ETF                            ,YIELDMAX XOM OPTION INC STRG ETF                            ,ETF,0,-,-,-,-,-,-,-,-,0.0
XYLD,Global X S&P 500 Covered Call ETF                           ,GLOBAL X S&P 500 COVERED CALL ETF                           ,ETF,68430000,-,-,-,-,-,-,-,-,0.0
YINN,Direxion Daily FTSE China Bull 3x ETF                       ,DIREXION DLY FTSE CHNA BUL 3X ETF                           ,ETF,35692767,-,-,-,-,-,-,-,-,0.0
YMAX,YIELDMAX UNIVRS FD OPT INCOM ETF                            ,YIELDMAX UNIVRS FD OPT INCOM ETF                            ,ETF,0,-,-,-,-,-,-,-,-,0.0
